{
  "$schema": "https://json-schema.org/draft/2020-12/schema",
  "$id": "https://github.com/Dorusto/yt-pipeline/schemas/similarity.schema.json",
  "title": "similarity",
  "description": "Visual similarity between quality segments, written by scripts/similarity.py once per workspace: one image embedding per segment and every pair whose cosine similarity reaches the threshold. The director uses the pairs to refuse near-duplicate shots; the embeddings allow a different threshold without re-extracting frames. Frames are never written to disk.",
  "type": "object",
  "required": ["generated_at", "backend", "model", "threshold", "segments", "pairs"],
  "$defs": {
    "segment_ref": {
      "type": "string",
      "minLength": 3,
      "description": "segment key: <clip counter>/<segment id>, e.g. 0081/s7"
    },
    "embedding": {
      "type": "array",
      "minItems": 8,
      "items": {"type": "number"},
      "description": "L2-normalised segment embedding, rounded to 4 decimals"
    }
  },
  "properties": {
    "generated_at": {
      "type": "string",
      "description": "ISO 8601 timestamp of the run"
    },
    "backend": {
      "type": "string",
      "enum": ["mobilenet", "hist"],
      "description": "embedding backend: mobilenet = MobileNetV2 ONNX through cv2.dnn, hist = handcrafted HSV/gradient/luma histograms (offline fallback)"
    },
    "model": {
      "type": "string",
      "description": "model artifact used by the backend, e.g. mobilenetv2-12.onnx"
    },
    "threshold": {
      "type": "number",
      "minimum": -1,
      "maximum": 1,
      "description": "pairs at or above this cosine similarity are listed"
    },
    "segments": {
      "type": "array",
      "minItems": 1,
      "description": "one entry per quality segment that contributed frames, in clip order",
      "items": {
        "type": "object",
        "required": ["key", "clip", "segment_id", "start_s", "end_s", "embedding"],
        "properties": {
          "key": {"$ref": "#/$defs/segment_ref"},
          "clip": {"type": "string", "minLength": 1},
          "segment_id": {"type": "string", "minLength": 1},
          "start_s": {"type": "number", "minimum": 0},
          "end_s": {"type": "number", "exclusiveMinimum": 0},
          "embedding": {"$ref": "#/$defs/embedding"}
        },
        "additionalProperties": true
      }
    },
    "pairs": {
      "type": "array",
      "description": "every pair with cosine similarity >= threshold, most similar first",
      "items": {
        "type": "object",
        "required": ["a", "b", "similarity"],
        "properties": {
          "a": {"$ref": "#/$defs/segment_ref"},
          "b": {"$ref": "#/$defs/segment_ref"},
          "similarity": {"type": "number", "minimum": -1, "maximum": 1}
        },
        "additionalProperties": true
      }
    },
    "wall_time_s": {
      "type": "number",
      "minimum": 0
    },
    "llm_cost_usd": {
      "type": "number",
      "minimum": 0,
      "description": "always 0: this tool calls no model service"
    },
    "warnings": {
      "type": "array",
      "items": {"type": "string"}
    }
  },
  "additionalProperties": true
}
